{
  "user_id": "user_09",
  "name": "王总",
  "age": 45,
  "profile": "私企老板，资金链断裂引发健康+婚姻连锁危机",
  "monthly_income": 150000,
  "event_day": 38,
  "event": "大客户拖欠80万→现金流断裂→心脏病住院→妻子出走→裁员→缓慢重建",
  "data_range": {"start": "2026-01-01", "end": "2026-03-31"},
  "v3_extensions": {
    "drift_class": "severe",
    "vulnerability_class": "business_collapse_with_health_crisis",
    "crisis_windows": [
      {"day_range": [38, 45], "trigger": "资金链断裂", "expected_severity": "severe"},
      {"day_range": [42, 55], "trigger": "心脏病住院", "expected_severity": "critical"},
      {"day_range": [50, 70], "trigger": "妻子出走+被迫裁员", "expected_severity": "severe"}
    ],
    "social_context": {
      "living_situation": "自有房产（住院期间由秘书照料）",
      "support_network": "商会朋友（危机后疏远）、秘书",
      "key_relationships": ["妻子（出走）", "员工（需裁减）", "大客户（欠款方）"]
    },
    "ethical_notes": "高收入人群的崩塌模式独特——经济数据可能显示'还有钱'但实际已资不抵债。心脏病住院期间的数据断流需特殊处理。"
  }
}
